{
  "schema": "hebrinex.legacy_migration_snapshot",
  "schema_version": 1,
  "operation_id": "OP-00000000000000000000000000000000",
  "project_id": "PRJ-00000000000000000000000000000000",
  "source_version": "0.16.0",
  "source_tree_sha256": "0000000000000000000000000000000000000000000000000000000000000000",
  "post_migration_tree_sha256": "0000000000000000000000000000000000000000000000000000000000000000",
  "created_at": "1970-01-01T00:00:00.0000000Z",
  "files": [{ "path": "PROJECT_BINDING.yaml", "sha256": "0000000000000000000000000000000000000000000000000000000000000000", "size": 0 }]
}
